,anime_id,name,genre,type,episodes,rating,members
579,5485,Shin Mazinger Shougeki! Z-hen,Action,TV,26,7.96,7872
579,5485,Shin Mazinger Shougeki! Z-hen, Mecha,TV,26,7.96,7872
579,5485,Shin Mazinger Shougeki! Z-hen, Shounen,TV,26,7.96,7872
579,5485,Shin Mazinger Shougeki! Z-hen, Super Power,TV,26,7.96,7872
4337,21569,Pokemon XY: Hakai no Mayu to Diancie,Adventure,Movie,1,6.75,9290
4337,21569,Pokemon XY: Hakai no Mayu to Diancie, Fantasy,Movie,1,6.75,9290
4337,21569,Pokemon XY: Hakai no Mayu to Diancie, Kids,Movie,1,6.75,9290
4876,9943,Ore-sama Kingdom,Romance,OVA,14,6.61,1846
4876,9943,Ore-sama Kingdom, Shoujo,OVA,14,6.61,1846
10232,22657,Shin Seikimatsu: Yatsuto no Souguu,Comedy,ONA,5,4.9,73
10232,22657,Shin Seikimatsu: Yatsuto no Souguu, Sci-Fi,ONA,5,4.9,73
2935,4773,Yamato Takeru,Action,TV,37,7.13,883
2935,4773,Yamato Takeru, Adventure,TV,37,7.13,883
2935,4773,Yamato Takeru, Fantasy,TV,37,7.13,883
2935,4773,Yamato Takeru, Magic,TV,37,7.13,883
2935,4773,Yamato Takeru, Mecha,TV,37,7.13,883
2935,4773,Yamato Takeru, Sci-Fi,TV,37,7.13,883
2935,4773,Yamato Takeru, Shounen,TV,37,7.13,883
2935,4773,Yamato Takeru, Space,TV,37,7.13,883
1259,9181,Motto To LOVE-Ru,Comedy,TV,12,7.61,134988
1259,9181,Motto To LOVE-Ru, Ecchi,TV,12,7.61,134988
1259,9181,Motto To LOVE-Ru, Harem,TV,12,7.61,134988
1259,9181,Motto To LOVE-Ru, School,TV,12,7.61,134988
1259,9181,Motto To LOVE-Ru, Sci-Fi,TV,12,7.61,134988
1259,9181,Motto To LOVE-Ru, Shounen,TV,12,7.61,134988
10350,16163,Sore Ike! Anpanman: Kirakira Boshi no Namida,Adventure,Movie,1,6.07,121
10350,16163,Sore Ike! Anpanman: Kirakira Boshi no Namida, Comedy,Movie,1,6.07,121
10350,16163,Sore Ike! Anpanman: Kirakira Boshi no Namida, Kids,Movie,1,6.07,121
10350,16163,Sore Ike! Anpanman: Kirakira Boshi no Namida, Super Power,Movie,1,6.07,121
8627,21525,Geba Geba Shou Time!,Comedy,OVA,1,5.0,50
4490,2067,Gekiganger 3: The Movie,Action,OVA,1,6.71,2562
4490,2067,Gekiganger 3: The Movie, Comedy,OVA,1,6.71,2562
4490,2067,Gekiganger 3: The Movie, Mecha,OVA,1,6.71,2562
4490,2067,Gekiganger 3: The Movie, Parody,OVA,1,6.71,2562
4490,2067,Gekiganger 3: The Movie, Sci-Fi,OVA,1,6.71,2562
4490,2067,Gekiganger 3: The Movie, Shounen,OVA,1,6.71,2562
4680,32214,Koukaku no Pandora,Action,TV,12,6.66,25545
4680,32214,Koukaku no Pandora, Comedy,TV,12,6.66,25545
4680,32214,Koukaku no Pandora, Ecchi,TV,12,6.66,25545
4680,32214,Koukaku no Pandora, Sci-Fi,TV,12,6.66,25545
11909,2344,Choujin Densetsu Urotsukidouji: Inferno Road,Demons,OVA,3,5.91,1210
11909,2344,Choujin Densetsu Urotsukidouji: Inferno Road, Fantasy,OVA,3,5.91,1210
11909,2344,Choujin Densetsu Urotsukidouji: Inferno Road, Hentai,OVA,3,5.91,1210
11909,2344,Choujin Densetsu Urotsukidouji: Inferno Road, Horror,OVA,3,5.91,1210
11909,2344,Choujin Densetsu Urotsukidouji: Inferno Road, Sci-Fi,OVA,3,5.91,1210
4539,472,To Heart,Drama,TV,13,6.7,16757
4539,472,To Heart, Harem,TV,13,6.7,16757
4539,472,To Heart, Romance,TV,13,6.7,16757
4539,472,To Heart, School,TV,13,6.7,16757
4539,472,To Heart, Slice of Life,TV,13,6.7,16757
9073,10236,Kagee Grimm Douwa,Adventure,TV,52,5.94,129
9073,10236,Kagee Grimm Douwa, Demons,TV,52,5.94,129
9073,10236,Kagee Grimm Douwa, Drama,TV,52,5.94,129
9073,10236,Kagee Grimm Douwa, Fantasy,TV,52,5.94,129
9073,10236,Kagee Grimm Douwa, Historical,TV,52,5.94,129
9073,10236,Kagee Grimm Douwa, Kids,TV,52,5.94,129
9073,10236,Kagee Grimm Douwa, Magic,TV,52,5.94,129
9073,10236,Kagee Grimm Douwa, Romance,TV,52,5.94,129
9073,10236,Kagee Grimm Douwa, Supernatural,TV,52,5.94,129
2921,3136,Ochamegami Monogatari: Korokoro Pollon,Comedy,TV,46,7.13,1049
2921,3136,Ochamegami Monogatari: Korokoro Pollon, Magic,TV,46,7.13,1049
2921,3136,Ochamegami Monogatari: Korokoro Pollon, Parody,TV,46,7.13,1049
3025,11355,"Kono Danshi, Uchuujin to Tatakaemasu.",Action,OVA,1,7.1,12732
3025,11355,"Kono Danshi, Uchuujin to Tatakaemasu.", Fantasy,OVA,1,7.1,12732
3025,11355,"Kono Danshi, Uchuujin to Tatakaemasu.", Shounen Ai,OVA,1,7.1,12732
3025,11355,"Kono Danshi, Uchuujin to Tatakaemasu.", Super Power,OVA,1,7.1,12732
3025,11355,"Kono Danshi, Uchuujin to Tatakaemasu.", Supernatural,OVA,1,7.1,12732
3175,9712,Maria†Holic Alive,Comedy,TV,12,7.06,40502
3175,9712,Maria†Holic Alive, Parody,TV,12,7.06,40502
3175,9712,Maria†Holic Alive, School,TV,12,7.06,40502
3175,9712,Maria†Holic Alive, Shoujo Ai,TV,12,7.06,40502
2766,2011,Taiho Shichau zo Special,Action,TV,20,7.17,2856
2766,2011,Taiho Shichau zo Special, Comedy,TV,20,7.17,2856
2766,2011,Taiho Shichau zo Special, Police,TV,20,7.17,2856
2766,2011,Taiho Shichau zo Special, Shounen,TV,20,7.17,2856
10618,12903,Tsushima Maru: Sayounara Okinawa,Historical,Movie,1,7.09,120
7701,29766,Playground,Dementia,Movie,1,5.11,195
11338,4590,Soukan Yuugi,Hentai,OVA,2,6.8,4491
8564,23971,Fuku-chan no Zousan Butai,Comedy,Movie,1,7.4,68
8564,23971,Fuku-chan no Zousan Butai, Historical,Movie,1,7.4,68
12189,7162,Yaruki Manman,Comedy,OVA,3,5.31,251
12189,7162,Yaruki Manman, Hentai,OVA,3,5.31,251
12189,7162,Yaruki Manman, Parody,OVA,3,5.31,251
5690,19351,Nijiiro☆Prism Girl,Comedy,OVA,4,6.38,1390
5690,19351,Nijiiro☆Prism Girl, Romance,OVA,4,6.38,1390
5690,19351,Nijiiro☆Prism Girl, School,OVA,4,6.38,1390
5690,19351,Nijiiro☆Prism Girl, Shoujo,OVA,4,6.38,1390
3424,5830,Tsurupika Hagemaru-kun,Comedy,TV,59,7.0,322
3424,5830,Tsurupika Hagemaru-kun, Kids,TV,59,7.0,322
8655,30042,Geori-eui Mubeopja,Action,Movie,1,5.53,179
8655,30042,Geori-eui Mubeopja, Martial Arts,Movie,1,5.53,179
6819,6787,Goulart Knights: Evoked the Beginning Black,Action,OVA,1,5.91,8002
6819,6787,Goulart Knights: Evoked the Beginning Black, Drama,OVA,1,5.91,8002
6819,6787,Goulart Knights: Evoked the Beginning Black, Fantasy,OVA,1,5.91,8002
6819,6787,Goulart Knights: Evoked the Beginning Black, Shoujo,OVA,1,5.91,8002
6819,6787,Goulart Knights: Evoked the Beginning Black, Supernatural,OVA,1,5.91,8002
6307,310,"Chiisana Obake Acchi, Kocchi, Socchi",Comedy,TV,50,6.17,1226
6307,310,"Chiisana Obake Acchi, Kocchi, Socchi", Supernatural,TV,50,6.17,1226
5152,21679,"Saikin, Imouto no Yousu ga Chotto Okashiinda ga. OVA",Comedy,OVA,1,6.54,14564
5152,21679,"Saikin, Imouto no Yousu ga Chotto Okashiinda ga. OVA", Ecchi,OVA,1,6.54,14564
5152,21679,"Saikin, Imouto no Yousu ga Chotto Okashiinda ga. OVA", Romance,OVA,1,6.54,14564
5152,21679,"Saikin, Imouto no Yousu ga Chotto Okashiinda ga. OVA", Shounen,OVA,1,6.54,14564
5152,21679,"Saikin, Imouto no Yousu ga Chotto Okashiinda ga. OVA", Supernatural,OVA,1,6.54,14564
5715,2760,Densetsu Kyojin Ideon: Sesshoku-hen,Drama,Movie,1,6.37,1740
5715,2760,Densetsu Kyojin Ideon: Sesshoku-hen, Mecha,Movie,1,6.37,1740
5715,2760,Densetsu Kyojin Ideon: Sesshoku-hen, Sci-Fi,Movie,1,6.37,1740
5715,2760,Densetsu Kyojin Ideon: Sesshoku-hen, Space,Movie,1,6.37,1740
4640,2638,Doraemon: It&#039;s Spring!,Adventure,Special,1,6.67,476
4640,2638,Doraemon: It&#039;s Spring!, Comedy,Special,1,6.67,476
4640,2638,Doraemon: It&#039;s Spring!, Fantasy,Special,1,6.67,476
4640,2638,Doraemon: It&#039;s Spring!, Kids,Special,1,6.67,476
4640,2638,Doraemon: It&#039;s Spring!, Shounen,Special,1,6.67,476
7167,2220,Be-Boy Kidnapp&#039;n Idol,Drama,OVA,1,5.67,4311
7167,2220,Be-Boy Kidnapp&#039;n Idol, Shounen Ai,OVA,1,5.67,4311
103,11917,Major: World Series,Comedy,OVA,2,8.5,13405
103,11917,Major: World Series, Drama,OVA,2,8.5,13405
103,11917,Major: World Series, Sports,OVA,2,8.5,13405
5180,576,Magikano,Comedy,TV,13,6.53,22664
5180,576,Magikano, Fantasy,TV,13,6.53,22664
5180,576,Magikano, Harem,TV,13,6.53,22664
5180,576,Magikano, Magic,TV,13,6.53,22664
5180,576,Magikano, Romance,TV,13,6.53,22664
5180,576,Magikano, Shounen,TV,13,6.53,22664
11595,3308,Heartwork: Symphony of Destruction,Action,OVA,3,6.38,2197
11595,3308,Heartwork: Symphony of Destruction, Hentai,OVA,3,6.38,2197
10157,28693,Seisho Gensou Fu: Adam to Eve,Historical,Movie,1,6.0,61
5064,6492,Minky Momo in Tabidachi no Eki,Drama,OVA,1,6.56,400
5064,6492,Minky Momo in Tabidachi no Eki, Fantasy,OVA,1,6.56,400
5064,6492,Minky Momo in Tabidachi no Eki, Magic,OVA,1,6.56,400
5064,6492,Minky Momo in Tabidachi no Eki, Shoujo,OVA,1,6.56,400
3680,15633,Code:Breaker OVA,Action,OVA,3,6.91,17814
3680,15633,Code:Breaker OVA, Comedy,OVA,3,6.91,17814
3680,15633,Code:Breaker OVA, Ecchi,OVA,3,6.91,17814
3680,15633,Code:Breaker OVA, School,OVA,3,6.91,17814
3680,15633,Code:Breaker OVA, Shounen,OVA,3,6.91,17814
3680,15633,Code:Breaker OVA, Super Power,OVA,3,6.91,17814
3680,15633,Code:Breaker OVA, Supernatural,OVA,3,6.91,17814
5324,1193,Happy Seven: The TV Manga,Comedy,TV,13,6.49,3287
5324,1193,Happy Seven: The TV Manga, Fantasy,TV,13,6.49,3287
5374,1903,Stratos 4: Logbook,Action,Special,1,6.48,1090
5374,1903,Stratos 4: Logbook, Ecchi,Special,1,6.48,1090
5374,1903,Stratos 4: Logbook, Sci-Fi,Special,1,6.48,1090
8845,4417,Hennako-chan,Comedy,ONA,6,6.04,129
10051,29935,Qin Shiming Yue Zhi: Tian Xing Jiu Ge,Action,ONA,3,7.07,194
10051,29935,Qin Shiming Yue Zhi: Tian Xing Jiu Ge, Fantasy,ONA,3,7.07,194
10051,29935,Qin Shiming Yue Zhi: Tian Xing Jiu Ge, Historical,ONA,3,7.07,194
10051,29935,Qin Shiming Yue Zhi: Tian Xing Jiu Ge, Martial Arts,ONA,3,7.07,194
8476,24663,Dororonpa!,Comedy,TV,115,7.5,104
8476,24663,Dororonpa!, Slice of Life,TV,115,7.5,104
8476,24663,Dororonpa!, Supernatural,TV,115,7.5,104
1089,21105,Love Stage!!,Comedy,TV,10,7.69,83397
1089,21105,Love Stage!!, Romance,TV,10,7.69,83397
1089,21105,Love Stage!!, Shounen Ai,TV,10,7.69,83397
7379,33103,Zekkyou Gakkyuu: Tensei,Horror,Special,2,5.49,844
7379,33103,Zekkyou Gakkyuu: Tensei, Shoujo,Special,2,5.49,844
7379,33103,Zekkyou Gakkyuu: Tensei, Supernatural,Special,2,5.49,844
1518,27899,Tokyo Ghoul √A,Action,TV,12,7.52,408357
1518,27899,Tokyo Ghoul √A, Drama,TV,12,7.52,408357
1518,27899,Tokyo Ghoul √A, Horror,TV,12,7.52,408357
1518,27899,Tokyo Ghoul √A, Mystery,TV,12,7.52,408357
1518,27899,Tokyo Ghoul √A, Psychological,TV,12,7.52,408357
1518,27899,Tokyo Ghoul √A, Seinen,TV,12,7.52,408357
1518,27899,Tokyo Ghoul √A, Supernatural,TV,12,7.52,408357
4590,289,Comic Party,Comedy,TV,13,6.68,12988
4590,289,Comic Party, Drama,TV,13,6.68,12988
1027,7647,Arakawa Under the Bridge,Comedy,TV,13,7.71,162622
1027,7647,Arakawa Under the Bridge, Romance,TV,13,7.71,162622
1027,7647,Arakawa Under the Bridge, Seinen,TV,13,7.71,162622
4630,2028,Zettai Muteki Raijin-Oh (1992),Mecha,OVA,4,6.68,224
4630,2028,Zettai Muteki Raijin-Oh (1992), Sci-Fi,OVA,4,6.68,224
4630,2028,Zettai Muteki Raijin-Oh (1992), Shounen,OVA,4,6.68,224
8162,21765,Ari to Hato (1959),Kids,Movie,1,4.74,91
11441,17541,Kotowari: Kimi no Kokoro no Koboreta Kakera,Hentai,OVA,2,6.61,2886
7887,2972,Kindan no Mokushiroku: Crystal Triangle,Adventure,OVA,1,4.75,878
7887,2972,Kindan no Mokushiroku: Crystal Triangle, Demons,OVA,1,4.75,878
7887,2972,Kindan no Mokushiroku: Crystal Triangle, Military,OVA,1,4.75,878
7887,2972,Kindan no Mokushiroku: Crystal Triangle, Mystery,OVA,1,4.75,878
2984,32607,Gi(a)rlish Number,Slice of Life,TV,12,7.11,35072
8103,27557,Ajisai no Uta,Comedy,OVA,3,5.57,111
8103,27557,Ajisai no Uta, Drama,OVA,3,5.57,111
8103,27557,Ajisai no Uta, Historical,OVA,3,5.57,111
5558,31845,Masou Gakuen HxH,Action,TV,12,6.42,68025
5558,31845,Masou Gakuen HxH, Comedy,TV,12,6.42,68025
5558,31845,Masou Gakuen HxH, Ecchi,TV,12,6.42,68025
5558,31845,Masou Gakuen HxH, Fantasy,TV,12,6.42,68025
5558,31845,Masou Gakuen HxH, Harem,TV,12,6.42,68025
5558,31845,Masou Gakuen HxH, Romance,TV,12,6.42,68025
5558,31845,Masou Gakuen HxH, School,TV,12,6.42,68025
5558,31845,Masou Gakuen HxH, Sci-Fi,TV,12,6.42,68025
1751,2336,Hikaru no Go: New Year Special,Comedy,Special,1,7.45,7418
1751,2336,Hikaru no Go: New Year Special, Game,Special,1,7.45,7418
1751,2336,Hikaru no Go: New Year Special, Shounen,Special,1,7.45,7418
1751,2336,Hikaru no Go: New Year Special, Supernatural,Special,1,7.45,7418
2515,6151,Final Fantasy VII: On the Way to a Smile - Episode: Denzel,Action,OVA,1,7.24,18795
2515,6151,Final Fantasy VII: On the Way to a Smile - Episode: Denzel, Fantasy,OVA,1,7.24,18795
2515,6151,Final Fantasy VII: On the Way to a Smile - Episode: Denzel, Super Power,OVA,1,7.24,18795
5362,3619,Nanako SOS,Comedy,TV,39,6.48,587
5362,3619,Nanako SOS, Parody,TV,39,6.48,587
5362,3619,Nanako SOS, Romance,TV,39,6.48,587
5362,3619,Nanako SOS, Super Power,TV,39,6.48,587
8479,20083,Doteraman,Comedy,TV,20,6.0,79
8479,20083,Doteraman, Sci-Fi,TV,20,6.0,79
9247,28035,Kitsune no Home Run Ou,Kids,Movie,1,4.16,94
9247,28035,Kitsune no Home Run Ou, Sports,Movie,1,4.16,94
3254,580,Kogepan,Comedy,TV,10,7.04,4436
6688,17733,Dibetagurashi: Ahiru no Seikatsu,Comedy,TV,39,5.99,586
6688,17733,Dibetagurashi: Ahiru no Seikatsu, Slice of Life,TV,39,5.99,586
1080,23251,Gugure! Kokkuri-san,Comedy,TV,12,7.69,87824
1080,23251,Gugure! Kokkuri-san, Shounen,TV,12,7.69,87824
1080,23251,Gugure! Kokkuri-san, Supernatural,TV,12,7.69,87824
9378,31673,Larva 2nd Season,Comedy,TV,34,7.05,92
11253,7178,Tony&#039;s Heroine Series: Kanojo wa Hanayome Kouhosei? Cinderella Collection,Hentai,OVA,2,6.97,3550
8206,30093,Ball yo Doko e Yuku,Comedy,ONA,1,3.89,114
554,28907,"Gate: Jieitai Kanochi nite, Kaku Tatakaeri",Action,TV,12,7.97,244314
554,28907,"Gate: Jieitai Kanochi nite, Kaku Tatakaeri", Adventure,TV,12,7.97,244314
554,28907,"Gate: Jieitai Kanochi nite, Kaku Tatakaeri", Fantasy,TV,12,7.97,244314
554,28907,"Gate: Jieitai Kanochi nite, Kaku Tatakaeri", Military,TV,12,7.97,244314
495,30831,Kono Subarashii Sekai ni Shukufuku wo!,Adventure,TV,10,8.03,244877
495,30831,Kono Subarashii Sekai ni Shukufuku wo!, Comedy,TV,10,8.03,244877
495,30831,Kono Subarashii Sekai ni Shukufuku wo!, Fantasy,TV,10,8.03,244877
495,30831,Kono Subarashii Sekai ni Shukufuku wo!, Supernatural,TV,10,8.03,244877
1360,5713,Minami-ke Betsubara,Comedy,OVA,1,7.57,21534
1360,5713,Minami-ke Betsubara, Slice of Life,OVA,1,7.57,21534
623,2890,Gake no Ue no Ponyo,Adventure,Movie,1,7.93,140277
623,2890,Gake no Ue no Ponyo, Fantasy,Movie,1,7.93,140277
234,265,Hajime no Ippo: Mashiba vs. Kimura,Comedy,OVA,1,8.28,40623
234,265,Hajime no Ippo: Mashiba vs. Kimura, Shounen,OVA,1,8.28,40623
234,265,Hajime no Ippo: Mashiba vs. Kimura, Sports,OVA,1,8.28,40623
3526,5045,Kamen no Maid Guy OVA,Action,OVA,1,6.96,7074
3526,5045,Kamen no Maid Guy OVA, Comedy,OVA,1,6.96,7074
3526,5045,Kamen no Maid Guy OVA, Ecchi,OVA,1,6.96,7074
2760,33713,Seihou Bukyou Outlaw Star Specials,Action,Special,2,7.16,1509
2760,33713,Seihou Bukyou Outlaw Star Specials, Adventure,Special,2,7.16,1509
2760,33713,Seihou Bukyou Outlaw Star Specials, Comedy,Special,2,7.16,1509
2760,33713,Seihou Bukyou Outlaw Star Specials, Ecchi,Special,2,7.16,1509
2760,33713,Seihou Bukyou Outlaw Star Specials, Sci-Fi,Special,2,7.16,1509
5050,6119,Cookin&#039; Idol Ai! Mai! Main!,Comedy,TV,305,6.56,956
5050,6119,Cookin&#039; Idol Ai! Mai! Main!, Kids,TV,305,6.56,956
3957,7774,Shin Koihime†Musou OVA,Comedy,OVA,1,6.84,5382
3957,7774,Shin Koihime†Musou OVA, Ecchi,OVA,1,6.84,5382
3957,7774,Shin Koihime†Musou OVA, Fantasy,OVA,1,6.84,5382
9888,19879,Osomatsu-kun: Suika no Hoshi kara Konnichiwa zansu!,Comedy,Movie,1,6.52,224
86,16498,Shingeki no Kyojin,Action,TV,25,8.54,896229
86,16498,Shingeki no Kyojin, Drama,TV,25,8.54,896229
86,16498,Shingeki no Kyojin, Fantasy,TV,25,8.54,896229
86,16498,Shingeki no Kyojin, Shounen,TV,25,8.54,896229
86,16498,Shingeki no Kyojin, Super Power,TV,25,8.54,896229
10382,21967,Sore Ike! Anpanman: Yousei Rinrin no Himitsu,Comedy,Movie,1,5.88,74
10382,21967,Sore Ike! Anpanman: Yousei Rinrin no Himitsu, Fantasy,Movie,1,5.88,74
10382,21967,Sore Ike! Anpanman: Yousei Rinrin no Himitsu, Kids,Movie,1,5.88,74
645,34036,Detective Conan: Episode One - Chiisaku Natta Meitantei,Adventure,Special,1,8.1,2493
645,34036,Detective Conan: Episode One - Chiisaku Natta Meitantei, Comedy,Special,1,8.1,2493
645,34036,Detective Conan: Episode One - Chiisaku Natta Meitantei, Mystery,Special,1,8.1,2493
645,34036,Detective Conan: Episode One - Chiisaku Natta Meitantei, Police,Special,1,8.1,2493
645,34036,Detective Conan: Episode One - Chiisaku Natta Meitantei, Shounen,Special,1,8.1,2493
7444,1075,Netrun-mon the Movie,Comedy,OVA,1,5.42,961
1573,6325,Naruto: Shippuuden Movie 3 - Hi no Ishi wo Tsugu Mono,Action,Movie,1,7.5,83515
1573,6325,Naruto: Shippuuden Movie 3 - Hi no Ishi wo Tsugu Mono, Comedy,Movie,1,7.5,83515
1573,6325,Naruto: Shippuuden Movie 3 - Hi no Ishi wo Tsugu Mono, Martial Arts,Movie,1,7.5,83515
1573,6325,Naruto: Shippuuden Movie 3 - Hi no Ishi wo Tsugu Mono, Shounen,Movie,1,7.5,83515
1573,6325,Naruto: Shippuuden Movie 3 - Hi no Ishi wo Tsugu Mono, Super Power,Movie,1,7.5,83515
3220,1119,Pokemon: Celebi Toki wo Koeta Deai,Adventure,Movie,1,7.05,58359
3220,1119,Pokemon: Celebi Toki wo Koeta Deai, Comedy,Movie,1,7.05,58359
3220,1119,Pokemon: Celebi Toki wo Koeta Deai, Drama,Movie,1,7.05,58359
3220,1119,Pokemon: Celebi Toki wo Koeta Deai, Fantasy,Movie,1,7.05,58359
3220,1119,Pokemon: Celebi Toki wo Koeta Deai, Kids,Movie,1,7.05,58359
10387,33188,Sore Ike! Sabuibo Mask,Comedy,TV,8,3.0,101
10387,33188,Sore Ike! Sabuibo Mask, Slice of Life,TV,8,3.0,101
403,21855,Hanamonogatari,Comedy,TV,5,8.11,124886
403,21855,Hanamonogatari, Mystery,TV,5,8.11,124886
403,21855,Hanamonogatari, Supernatural,TV,5,8.11,124886
8836,18033,Hello Kitty no Yuubinya-san Arigatou,Fantasy,OVA,1,6.23,109
8836,18033,Hello Kitty no Yuubinya-san Arigatou, Kids,OVA,1,6.23,109
5019,819,Boku wa Imouto ni Koi wo Suru,Romance,OVA,1,6.57,26923
5019,819,Boku wa Imouto ni Koi wo Suru, Shoujo,OVA,1,6.57,26923
1427,32792,Mobile Suit Gundam Unicorn RE:0096,Action,TV,22,7.56,9767
1427,32792,Mobile Suit Gundam Unicorn RE:0096, Drama,TV,22,7.56,9767
1427,32792,Mobile Suit Gundam Unicorn RE:0096, Mecha,TV,22,7.56,9767
1427,32792,Mobile Suit Gundam Unicorn RE:0096, Military,TV,22,7.56,9767
1427,32792,Mobile Suit Gundam Unicorn RE:0096, Sci-Fi,TV,22,7.56,9767
1427,32792,Mobile Suit Gundam Unicorn RE:0096, Space,TV,22,7.56,9767
6298,34048,Seoul-yeok,Horror,Movie,1,6.18,405
6298,34048,Seoul-yeok, Thriller,Movie,1,6.18,405
11998,24743,Yakin Byoutou Specials,Hentai,OVA,2,5.76,608
1763,6153,Saint Seiya: Soushuuhen,Adventure,Special,1,7.45,4031
1763,6153,Saint Seiya: Soushuuhen, Fantasy,Special,1,7.45,4031
1763,6153,Saint Seiya: Soushuuhen, Sci-Fi,Special,1,7.45,4031
1763,6153,Saint Seiya: Soushuuhen, Shounen,Special,1,7.45,4031
9472,10135,Manga Hajimete Monogatari,Adventure,TV,305,6.36,169
9472,10135,Manga Hajimete Monogatari, Comedy,TV,305,6.36,169
9472,10135,Manga Hajimete Monogatari, Historical,TV,305,6.36,169
12112,5285,SeeIn AO,Hentai,OVA,2,5.52,487
5419,1883,Kappa no Kaikata,Comedy,TV,26,6.46,1209
5508,12967,Arcana Famiglia,Action,TV,12,6.43,106391
5508,12967,Arcana Famiglia, Harem,TV,12,6.43,106391
5508,12967,Arcana Famiglia, Romance,TV,12,6.43,106391
5508,12967,Arcana Famiglia, Shoujo,TV,12,6.43,106391
9519,25265,Megumi to Taiyou: Kajuu Gummi Tweet Love Story,Romance,Special,1,5.36,232
9519,25265,Megumi to Taiyou: Kajuu Gummi Tweet Love Story, Slice of Life,Special,1,5.36,232
9245,33858,Kissaten Soudou,Comedy,ONA,1,3.46,34
652,19489,Little Witch Academia: Mahoujikake no Parade,Adventure,Movie,1,7.92,53024
652,19489,Little Witch Academia: Mahoujikake no Parade, Comedy,Movie,1,7.92,53024
652,19489,Little Witch Academia: Mahoujikake no Parade, Fantasy,Movie,1,7.92,53024
652,19489,Little Witch Academia: Mahoujikake no Parade, Magic,Movie,1,7.92,53024
652,19489,Little Witch Academia: Mahoujikake no Parade, School,Movie,1,7.92,53024
455,33032,Drifters: Special Edition,Action,OVA,1,8.06,9807
455,33032,Drifters: Special Edition, Adventure,OVA,1,8.06,9807
455,33032,Drifters: Special Edition, Comedy,OVA,1,8.06,9807
455,33032,Drifters: Special Edition, Fantasy,OVA,1,8.06,9807
455,33032,Drifters: Special Edition, Historical,OVA,1,8.06,9807
455,33032,Drifters: Special Edition, Samurai,OVA,1,8.06,9807
455,33032,Drifters: Special Edition, Seinen,OVA,1,8.06,9807
1952,6380,Tetsuwan Birdy Decode: The Cipher,Action,OVA,1,7.4,12944
1952,6380,Tetsuwan Birdy Decode: The Cipher, Comedy,OVA,1,7.4,12944
1952,6380,Tetsuwan Birdy Decode: The Cipher, Sci-Fi,OVA,1,7.4,12944
8842,22441,Hello Kitty: Ringo no Mori to Parallel Town,Comedy,TV,27,6.38,115
8842,22441,Hello Kitty: Ringo no Mori to Parallel Town, Fantasy,TV,27,6.38,115
8842,22441,Hello Kitty: Ringo no Mori to Parallel Town, Kids,TV,27,6.38,115
195,1033,Sennen Joyuu,Action,Movie,1,8.34,58492
195,1033,Sennen Joyuu, Adventure,Movie,1,8.34,58492
195,1033,Sennen Joyuu, Drama,Movie,1,8.34,58492
195,1033,Sennen Joyuu, Fantasy,Movie,1,8.34,58492
195,1033,Sennen Joyuu, Historical,Movie,1,8.34,58492
195,1033,Sennen Joyuu, Romance,Movie,1,8.34,58492
3937,723,Candy Candy (Movie),Drama,Movie,1,6.84,2110
3937,723,Candy Candy (Movie), Shoujo,Movie,1,6.84,2110
3937,723,Candy Candy (Movie), Slice of Life,Movie,1,6.84,2110
7946,7027,Manga,Comedy,Movie,1,4.52,492
8232,8521,Biriken Nandemo Shoukai,Comedy,TV,22,4.77,96
8232,8521,Biriken Nandemo Shoukai, Kids,TV,22,4.77,96
2346,352,Motto! Ojamajo Doremi,Comedy,TV,50,7.29,8760
2346,352,Motto! Ojamajo Doremi, Fantasy,TV,50,7.29,8760
2346,352,Motto! Ojamajo Doremi, Magic,TV,50,7.29,8760
2346,352,Motto! Ojamajo Doremi, Shoujo,TV,50,7.29,8760
11237,30898,Tsunpri,Hentai,OVA,1,7.02,2362
2020,152,Solty Rei,Action,TV,24,7.38,17943
2020,152,Solty Rei, Sci-Fi,TV,24,7.38,17943
2020,152,Solty Rei, Super Power,TV,24,7.38,17943
8155,34249,Aqua Kids,Adventure,TV,26,6.5,24
8155,34249,Aqua Kids, Kids,TV,26,6.5,24
8387,32944,CoCO &amp; NiCO,Comedy,TV,39,4.53,318
8387,32944,CoCO &amp; NiCO, Kids,TV,39,4.53,318
2636,19877,Battle Spirits: Sword Eyes Gekitouden,Shounen,TV,21,7.21,570
11685,1558,Yarima Queen,Comedy,OVA,1,6.26,2153
11685,1558,Yarima Queen, Demons,OVA,1,6.26,2153
11685,1558,Yarima Queen, Fantasy,OVA,1,6.26,2153
11685,1558,Yarima Queen, Hentai,OVA,1,6.26,2153
11685,1558,Yarima Queen, Magic,OVA,1,6.26,2153
11685,1558,Yarima Queen, Parody,OVA,1,6.26,2153
9240,31071,"Kinyoru, Abe Reiji: Heikinteki na Salaryman no Ijou na Nichijou",Comedy,TV,5,4.14,234
11569,24273,Iinari! Saimin Kanojo,Hentai,OVA,2,6.41,2867
8226,3909,Bikkuriman,Comedy,TV,75,6.68,250
8226,3909,Bikkuriman, Fantasy,TV,75,6.68,250
10142,33860,Saru Kani Gassen (Yokoku),Historical,ONA,1,2.84,38
8316,17893,Cheonbangjichuk Hani,Comedy,TV,13,6.78,149
8316,17893,Cheonbangjichuk Hani, Drama,TV,13,6.78,149
8316,17893,Cheonbangjichuk Hani, School,TV,13,6.78,149
8316,17893,Cheonbangjichuk Hani, Sports,TV,13,6.78,149
653,4472,Lucky☆Star: Original na Visual to Animation,Comedy,OVA,1,7.92,84833
653,4472,Lucky☆Star: Original na Visual to Animation, Parody,OVA,1,7.92,84833
653,4472,Lucky☆Star: Original na Visual to Animation, School,OVA,1,7.92,84833
653,4472,Lucky☆Star: Original na Visual to Animation, Slice of Life,OVA,1,7.92,84833
6693,1220,Hoshizora Kiseki,Romance,ONA,1,5.99,7674
6693,1220,Hoshizora Kiseki, Sci-Fi,ONA,1,5.99,7674
10659,10909,Ultraman Kids: M7.8 Sei no Yukai na Nakama,Kids,Movie,1,5.39,118
10659,10909,Ultraman Kids: M7.8 Sei no Yukai na Nakama, Super Power,Movie,1,5.39,118
3737,4073,Kyouryuu Daisensou Aizenborg,Action,TV,39,6.9,411
3737,4073,Kyouryuu Daisensou Aizenborg, Mecha,TV,39,6.9,411
2590,5691,Rekka no Honoo: Final Burning,Action,Special,1,7.22,4083
2590,5691,Rekka no Honoo: Final Burning, Adventure,Special,1,7.22,4083
2590,5691,Rekka no Honoo: Final Burning, Magic,Special,1,7.22,4083
2590,5691,Rekka no Honoo: Final Burning, Martial Arts,Special,1,7.22,4083
2590,5691,Rekka no Honoo: Final Burning, School,Special,1,7.22,4083
2590,5691,Rekka no Honoo: Final Burning, Sci-Fi,Special,1,7.22,4083
2590,5691,Rekka no Honoo: Final Burning, Super Power,Special,1,7.22,4083
9150,20127,Kariage-kun,Comedy,TV,59,6.5,79
9150,20127,Kariage-kun, Seinen,TV,59,6.5,79
9150,20127,Kariage-kun, Slice of Life,TV,59,6.5,79
8210,16514,Batsu &amp; Terry,Comedy,Movie,1,6.19,152
8210,16514,Batsu &amp; Terry, Drama,Movie,1,6.19,152
8210,16514,Batsu &amp; Terry, School,Movie,1,6.19,152
8210,16514,Batsu &amp; Terry, Shounen,Movie,1,6.19,152
8210,16514,Batsu &amp; Terry, Sports,Movie,1,6.19,152
8804,22489,Hello Kitty no Hansel to Gretel,Fantasy,OVA,1,5.76,117
8804,22489,Hello Kitty no Hansel to Gretel, Kids,OVA,1,5.76,117
6241,23753,Kishin Houkou Demonbane (TV) Specials,Magic,Special,2,6.2,571
6241,23753,Kishin Houkou Demonbane (TV) Specials, Mecha,Special,2,6.2,571
6241,23753,Kishin Houkou Demonbane (TV) Specials, Sci-Fi,Special,2,6.2,571
6241,23753,Kishin Houkou Demonbane (TV) Specials, Supernatural,Special,2,6.2,571
220,33161,Yahari Ore no Seishun Love Comedy wa Machigatteiru. Zoku OVA,Comedy,OVA,1,8.31,35120
220,33161,Yahari Ore no Seishun Love Comedy wa Machigatteiru. Zoku OVA, Romance,OVA,1,8.31,35120
220,33161,Yahari Ore no Seishun Love Comedy wa Machigatteiru. Zoku OVA, School,OVA,1,8.31,35120
2450,3946,Jarinko Chie,Comedy,Movie,1,7.26,1406
2450,3946,Jarinko Chie, Drama,Movie,1,7.26,1406
2450,3946,Jarinko Chie, Slice of Life,Movie,1,7.26,1406
9508,9821,McDull and Chinese Culture,Comedy,TV,5,6.79,90
9508,9821,McDull and Chinese Culture, Historical,TV,5,6.79,90
665,18897,Nisekoi,Comedy,TV,20,7.91,347599
665,18897,Nisekoi, Harem,TV,20,7.91,347599
665,18897,Nisekoi, Romance,TV,20,7.91,347599
665,18897,Nisekoi, School,TV,20,7.91,347599
665,18897,Nisekoi, Shounen,TV,20,7.91,347599
12201,2239,Sei Michaela Gakuen Hyouryuuki,Hentai,OVA,2,5.26,417
9276,33881,Kochira Katsushikaku Kameari Kouenmae Hashutsujo: Washi to Ore!? - Bokura wa Asakusa Shounen Tanteid,Comedy,Special,2,7.18,116
9276,33881,Kochira Katsushikaku Kameari Kouenmae Hashutsujo: Washi to Ore!? - Bokura wa Asakusa Shounen Tanteid, Police,Special,2,7.18,116
9437,22239,Mahou no Yousei Persia Pilot,Magic,Special,1,5.09,151
11319,21751,Okusama wa Moto Yariman,Hentai,OVA,2,6.83,3390
1034,7661,Giant Killing,Drama,TV,26,7.71,36947
1034,7661,Giant Killing, Seinen,TV,26,7.71,36947
1034,7661,Giant Killing, Sports,TV,26,7.71,36947
7885,13421,Wheels,Comedy,OVA,1,4.76,314
5787,2059,Mainichi ga Nichiyoubi,Comedy,OVA,6,6.35,735
5787,2059,Mainichi ga Nichiyoubi, Romance,OVA,6,6.35,735
1120,8217,Jewelpet Twinkle☆,Fantasy,TV,52,7.67,4110
1120,8217,Jewelpet Twinkle☆, Magic,TV,52,7.67,4110
